{
  "$schema": "https://json-schema.org/draft/2020-12/schema",
  "$id": "https://quox.ai/aocl/schemas/aocl-stack.schema.json",
  "$comment": "PROPOSED FOR UPSTREAM. Authored from AOCL v0.1 spec prose (aocl/docs/stacks.md, docs/examples.md) for the aocl v0.2 roadmap item 'Schemas & Validators'. The aocl spec repo ships no schemas/ directory at v0.1; this is a candidate contribution, not a normative artefact yet.",
  "title": "AOCL Stack Definition (v0.1)",
  "description": "A pipeline or DAG stack definition per docs/stacks.md. Layer ids follow the canonical L<n>.<group>.<name> shape; DAG branch nodes use the BR.<name> shape.",
  "type": "object",
  "required": ["stack_id", "version", "mode"],
  "$comment_open": "Spec is intentionally open (stacks.md §1: 'AOCL does not require these names'). Custom layer taxonomies and extra config keys are permitted, so additionalProperties is true and the pipeline layer id is a general identifier, matching the hand-rolled validateStack (which only WARNS on non-canonical ids). DAG node ids stay pattern-restricted to canonical L<n>.<group>.<name> or BR.<name> to match validateStack's error-level node check.",
  "additionalProperties": true,
  "properties": {
    "stack_id": { "type": "string", "minLength": 1 },
    "version": { "type": "string", "minLength": 1 },
    "mode": { "type": "string", "enum": ["pipeline", "dag"] },
    "layers": {
      "type": "array",
      "minItems": 1,
      "items": {
        "type": "object",
        "required": ["id"],
        "additionalProperties": true,
        "properties": {
          "id": { "type": "string", "minLength": 1 },
          "ref": { "type": "string" },
          "enabled": { "type": "boolean" }
        }
      }
    },
    "nodes": {
      "type": "array",
      "minItems": 1,
      "items": {
        "type": "object",
        "required": ["id"],
        "additionalProperties": true,
        "properties": {
          "id": { "type": "string", "pattern": "^(L\\d+\\.[a-z]+\\.[a-z]+|BR\\.[a-z_]+)$" },
          "ref": { "type": "string" }
        }
      }
    },
    "edges": {
      "type": "array",
      "items": {
        "type": "object",
        "required": ["from", "to"],
        "additionalProperties": true,
        "properties": {
          "from": { "type": "string", "minLength": 1 },
          "to": { "type": "string", "minLength": 1 },
          "when": { "type": "string" }
        }
      }
    },
    "defaults": { "type": "object", "additionalProperties": true },
    "bypass_policy": { "type": "object", "additionalProperties": true },
    "policy_overrides": { "type": "object", "additionalProperties": true }
  },
  "allOf": [
    {
      "if": { "properties": { "mode": { "const": "pipeline" } } },
      "then": { "required": ["layers"] }
    },
    {
      "if": { "properties": { "mode": { "const": "dag" } } },
      "then": { "required": ["nodes", "edges"] }
    }
  ]
}
